dspm,it is;data protection;data privacy;sensitive data;data security;zero trust;data management;data governance;and security;best practices;use cases;data breaches;data discovery;access control;cloud data;security posture;data sources;machine learning;sensitive information;and governance;least privilege;incident response;data intelligence;unstructured data;data risk;unauthorized access;and compliance;access controls;data classification;risk management;in the cloud;content marketing manager;backup and recovery;chief marketing officer;data security posture;3 minute read;security posture management;rolebased access control;how it works;university of denver;privacy and protection;data lifecycle management;data intelligence platform;security best practices;reduce the risk;5 minute read;sensitive data exposure;security and privacy;data loss prevention;cloud infrastructure security;detection and response;access to data;protect sensitive data;manage and protect;data privacy regulations;data risk management;reducing the risk;pros and cons;schedule a demo;deep data discovery;data security posture management;industry leading dspm provider;on the other hand;or in the cloud;rolebased access control rbac;structured and unstructured data;data discovery and classification;data protection and privacy;sensitive and regulated data;risk of data breaches;it and security leaders;director of product marketing;cloud security posture management;and protect their data;risk of data loss;bigid data intelligence platform;director of analyst relations;data governance and compliance;comply with regulatory requirements;data backup and recovery;granular rolebased access control;context of the data;cut through the noise;opening a jira ticket;security and it teams;protect against data exposure;key capabilities of dspm;centralizing data security functions;rapidly evolving data environments;data security platform management
jit infrastructure access,
identity and access management,it is;data protection;sensitive data;data security;zero trust;access management;justintime access;best practices;found in;last updated;data breaches;access control;security posture;least privilege;unauthorized access;access controls;cloud security;data access;content marketing;set up;rolebased access;cloud infrastructure;remote work;compliance requirements;user access;multifactor authentication;regulatory compliance;industry leading;work with;cloud computing;about the author;in the cloud;content marketing manager;rolebased access control;university of denver;policies and procedures;zero trust architecture;multifactor authentication mfa;5 minute read;zero trust security;protect sensitive data;management best practices;reducing the risk;pros and cons;zero trust strategy;single signon sso;regulatory compliance requirements;zero trust model;prevent unauthorized access;attributebased access control;what it means;iam best practices;rolebased access controls;roles and permissions;access management solutions;zero trust approach;access control policies;executive order 14028;traditional pam deployments;data access intelligence;justintime access to infrastructure;principle of least privilege;identity and access management;industry leading dspm provider;rolebased access control rbac;zero trust security model;access management best practices;never trust always verify;legacy pam augmentation guide;user vs nonpeople identities;and other security incidents;rolebased access controls rbac;comprehensive cloud security strategy
zero trust data security,it is;data protection;sensitive data;data security;zero trust;data management;and security;learn more;access control;machine learning;data risk;security teams;all data;critical data;live mount;security measures;backup data;set up;rolebased access;security controls;multifactor authentication;cyber threats;ransomware attack;ransomware attacks;infrastructure security;it teams;data exposure;cyber insurance;new data;business continuity;backup and recovery;rolebased access control;rubrik zero trust;zero trust architecture;multifactor authentication mfa;reduce the risk;sensitive data exposure;zero trust security;access to data;protect your data;data security strategy;zero trust principles;ability to recover;zero trust implementation;indicators of compromise;paying a ransom;data protection strategy;managed by rubrik;zero trust approach;paying the ransom;manage sensitive data;pay a ransom;appendonly file system;secure the data;backup and recover;protect critical data;declarative policy engine;timebased onetime passwords;legacy backup solutions;unified data protection;zero trust data security;rolebased access control rbac;zero trust data security™;national institute of standards;clean copy of data;rubrik zero trust architecture;backup and recovery requirements;zero trust implementation model
polp,it is;sensitive data;best practices;data breaches;access control;least privilege;and compliance;attack surface;critical data;set up;get started;cyber attacks;security risks;being used;human error;audit trail;and authorization;limiting access;critical systems;fault tolerance;user roles;users access;granted access;limit access;existing security;access data;malicious code;privileged credentials;potential damage;bad actor;need to know;least privilege access;reducing the risk;data and systems;access control model;access control mechanisms;access control system;user requests access;just enough access;finetune least privilege;comprehensive access insights;existing security infrastructure;broad attack surface;critical security concept;accounting aaa systems;scope of attacks;privileged threat vectors;spread of malware;internal company policies;mistype a command;principle of least privilege;risk of data breaches;principles of least privilege;organizations existing security infrastructure;least privilege endpoint management;accidentally delete crucial information
cloud data management,it is;data protection;data privacy;sensitive data;data security;data management;data governance;best practices;for example;learn more;use cases;data discovery;access control;cloud data;data sources;machine learning;sensitive information;data center;data quality;and governance;data intelligence;and compliance;access controls;data classification;risk management;public cloud;cloud security;all data;data access;content marketing;in the cloud;content marketing manager;backup and recovery;chief marketing officer;cloud data management;rolebased access control;how it works;university of denver;privacy and protection;data lifecycle management;subject matter experts;data management solution;bigids author collective;data security suite;security and privacy;data management platform;amazon web services;protect sensitive data;manage and protect;time and money;security by design;source of truth;backup and restore;machine learning algorithms;data retention policies;advanced machine learning;protect sensitive information;cloud service providers;and cloud environments;recover from ransomware;industry leading dspm provider;on the other hand;bigid data security suite;single pane of glass;or in the cloud;data protection and privacy;sensitive and regulated data;record of processing activities;amazon web services aws;cloud data management platform;such as multifactor authentication;trusted platform module tpm;fips 1402 level 2;bigid ceo dimitri sirota;google cloud platform gcp;migrate to the cloud;data backup and recovery;vcloud director user interface;cloud data management framework;source of the data;cloud data management challenges;remote and branch offices;backup and restore process;relevant data quality scores;comprehensive data management solution;london stock exchange group;data governance and accountability;multijurisdictional cloud adoption strategies;data sourcing and authorities;data cataloging and classification
data security,it is;data protection;data privacy;sensitive data;data security;personal data;zero trust;data management;personal information;data governance;access management;and security;best practices;for example;data breach;learn more;use cases;data breaches;data discovery;access control;cloud data;security posture;data sources;machine learning;sensitive information;data center;and governance;least privilege;data rights;incident response;in the cloud;content marketing manager;backup and recovery;chief marketing officer;data security posture;rubrik security cloud;privacy and security;cloud data management;3 minute read;security posture management;types of data;rolebased access control;how it works;university of denver;2 minute read;policies and procedures;privacy and protection;data intelligence platform;rubrik zero trust;security best practices;personally identifiable information;type of data;social security numbers;zero trust architecture;data security suite;sensitive data discovery;multifactor authentication mfa;protected health information;know your data;reduce the risk;identity and access management;data security posture management;industry leading dspm provider;on the other hand;zero trust data security;bigid data security suite;or in the cloud;rolebased access control rbac;structured and unstructured data;personally identifiable information pii;zero trust data security™;data discovery and classification;sensitive and regulated data;risk of data breaches;it and security leaders;single source of truth;protected health information phi;director of product marketing;it and cybersecurity leaders;national institute of standards;state of data security;bigideas on the go;data visibility and control;backup and recovery solutions;data detection and response;enterprise backup and recovery;cloud security posture management;data security best practices;and protect their data;data loss prevention dlp
data protection,it is;data protection;data privacy;sensitive data;data security;personal data;zero trust;data management;personal information;data governance;access management;justintime access;and security;best practices;for example;data breach;found in;last updated;learn more;use cases;data breaches;access control;cloud data;data sources;machine learning;sensitive information;data center;and governance;least privilege;data rights;about the author;in the cloud;backup and recovery;rubrik security cloud;cloud data management;data protection regulation;3 minute read;types of data;need to know;consumer privacy act;2 minute read;privacy and protection;data lifecycle management;rubrik zero trust;security best practices;type of data;subject matter experts;data management solution;bigids author collective;data subject rights;personal data protection;5 minute read;point in time;data subject access;zero trust security;right to access;amount of data;data processing activities;crossborder data transfers;data loss prevention;justintime access to infrastructure;principle of least privilege;general data protection regulation;identity and access management;on the other hand;california consumer privacy act;zero trust data security;or in the cloud;data protection and privacy;data subject access requests;rubrik cloud data management;single source of truth;california privacy rights act;processing of personal data;privacy and data protection;cloud data management cdm;amazon web services aws;reduce the attack surface;where it is located;right to be forgotten;sale of personal data;right path toward compliance;california privacy protection agency;hybrid and multicloud environments;data security best practices;cloud data management platform;and protect their data;data loss prevention dlp;in this blog post;value of your data
data management,it is;data protection;data privacy;sensitive data;data security;data management;data governance;best practices;for example;learn more;use cases;data breaches;data discovery;access control;cloud data;security posture;data sources;machine learning;sensitive information;data center;data quality;and governance;data intelligence;unstructured data;unauthorized access;and compliance;access controls;data classification;risk management;public cloud;in the cloud;content marketing manager;backup and recovery;chief marketing officer;data security posture;rubrik security cloud;cloud data management;3 minute read;security posture management;types of data;rolebased access control;how it works;university of denver;2 minute read;privacy and protection;data lifecycle management;type of data;subject matter experts;data management solution;bigids author collective;data security suite;up and running;amount of data;security and privacy;data management platform;peace of mind;ai and ml;amazon web services;protect sensitive data;manage and protect;data security posture management;industry leading dspm provider;on the other hand;bigid data security suite;single pane of glass;or in the cloud;data protection and privacy;sensitive and regulated data;rubrik cloud data management;single source of truth;record of processing activities;bigideas on the go;amazon web services aws;enterprise backup and recovery;cloud data management platform;risk of data loss;archiving to the cloud;total cost of ownership;such as multifactor authentication;single points of failure;trusted platform module tpm;fips 1402 level 2;recovery time objective rto;bigid ceo dimitri sirota;global bookings run rate;director of analyst relations;google cloud platform gcp;migrate to the cloud;data secure posture management;poor reference data management
data privacy,it is;data protection;data privacy;sensitive data;data security;personal data;data management;personal information;data governance;and security;best practices;for example;data breach;found in;learn more;use cases;data breaches;data discovery;data sources;machine learning;sensitive information;data quality;and governance;data rights;incident response;data intelligence;unstructured data;data risk;unauthorized access;and compliance;in the cloud;content marketing manager;chief marketing officer;privacy and security;data protection regulation;3 minute read;need to know;university of denver;data privacy suite;consumer privacy act;2 minute read;privacy and protection;data lifecycle management;data intelligence platform;personally identifiable information;subject matter experts;bigids author collective;data subject rights;personal data protection;protected health information;5 minute read;data subject access;right to access;security and privacy;data processing activities;data rights management;ai and ml;sensitive personal information;know their data;data privacy regulations;general data protection regulation;industry leading dspm provider;bigid data privacy suite;on the other hand;california consumer privacy act;single pane of glass;or in the cloud;structured and unstructured data;personally identifiable information pii;data discovery and classification;data protection and privacy;sensitive and regulated data;data privacy and security;data subject access requests;protected health information phi;california privacy rights act;processing of personal data;record of processing activities;bigideas on the go;private right of action;data visibility and control;right to be forgotten;california privacy protection agency;out of the box;in this blog post;data subject access request;protection of personal information;bigid data intelligence platform;right to opt out;records of processing activities
data governance,it is;data protection;data privacy;sensitive data;data security;personal data;data management;personal information;data governance;and security;best practices;for example;data breach;learn more;use cases;data breaches;data discovery;iso 27001;access control;cloud data;data sources;machine learning;sensitive information;data quality;and governance;data rights;incident response;data intelligence;unstructured data;data risk;in the cloud;content marketing manager;backup and recovery;chief marketing officer;privacy and security;cloud data management;data protection regulation;3 minute read;rolebased access control;need to know;university of denver;consumer privacy act;2 minute read;policies and procedures;privacy and protection;data lifecycle management;data intelligence platform;personally identifiable information;subject matter experts;data management solution;bigids author collective;protected health information;know your data;5 minute read;point in time;data subject access;amount of data;security and privacy;data processing activities;ease of use;general data protection regulation;industry leading dspm provider;on the other hand;california consumer privacy act;or in the cloud;structured and unstructured data;personally identifiable information pii;data discovery and classification;sensitive and regulated data;data privacy and security;risk of data breaches;protected health information phi;bigideas on the go;data loss prevention dlp;data subject access request;bigid data intelligence platform;value of your data;and protect sensitive data;software development life cycle;bigid data governance suite;legal and regulatory requirements;proactive data governance program;cloud data management solution;data governance and compliance;specific point in time;comply with regulatory requirements;data backup and recovery;enforce governance for compliance;data governance use cases;take action on data
sensitive and regulated data,critical data;cloud environments;dark data;financial institutions;security policy;manage risk;highrisk data;empowers organizations;proactively protect;complete coverage;legacy stores;enforce security policy
rbac  role based access control,
structured and unstructured data,it is;data privacy;data security;data management;and governance;unstructured data;data risk;all data;11 demo;help organizations;regulated data;cloud computing;intellectual property;data inventory;data stewards;management platform;data source;manage risk;secure data;managing data;data organizations;structured data;highrisk data;cloud provider;business terms;one platform;cloud technologies;data warehouse;automatically classify;data users;3 minute read;data management platform;reduce data risk;bigid in action;large language models;risk and value;data source types;secrets and keys;native labeling frameworks;scan at creation;on the other hand;structured and unstructured data
data discovery and classification,it is;data discovery;machine learning;data intelligence;dark data;being used;first step;classify data;entire environment;discovery tools;ml classification;valuable assets;valuable context;deep data discovery;data discovery tools;machine learning classification
data protection and privacy,
risk of data breaches,
risk of data loss,
data backup and recovery,
zero standing privileges,it is;zero trust;access management;justintime access;best practices;found in;last updated;access control;least privilege;and compliance;access controls;attack surface;infrastructure access;rolebased access;security controls;user access;it teams;and monitoring;cyber insurance;sign up;security policies;security strategy;dynamic access;access requests;it infrastructure;standing privileges;tech stack;company data;and controls;access platform;about the author;in the cloud;zero trust architecture;dynamic access management;zero trust security;infrastructure access platform;do not need;zero standing privileges;reducing the risk;access to systems;rolebased access controls;justintime jit access;zero standing privilege;traditional pam solutions;strong access controls;least privilege model;chain of events;just in time;justintime access jit;reporting and monitoring;strongdm in action;attributebased access controls;better access control;sensitive company data;secrets and keys;user requests access;it support team;strict user permissions;standing shared accounts;policybased security controls;justintime access to infrastructure;dynamic access management dam;zero standing privileges zsp;zero trust security architecture;excessive administrative user access
preventing data breaches,
access to databases,
monitoring and auditing,anomaly detection;privilege escalation;suspicious activity;realtime monitoring;audit trails;pattern recognition;digital forensics;privilege escalation attempts
granular access controls,it is;least privilege;access controls;privilege escalation;best way;granular access;surface area;privilege abuse;elevated permissions;manager approval;access configuration;granular access controls;horizontal privilege escalation;principle of least privilege;role and access configuration
compliance and auditing,justintime access;compliance requirements;regulatory compliance;advanced insights;standing privileges;leastprivilege access;jit access;audit trails;central location;audit reports;granular view;privileged sessions;simplify audits;regulatory compliance requirements;enforcing leastprivilege access;external regulatory compliance;accurate audit reports;complete audit trails;logging privilegedaccess activities
zero trust architecture,sensitive data;zero trust;and security;for example;data breach;data center;least privilege;access controls;public cloud;and protection;security controls;multifactor authentication;cyber threats;ransomware attack;privacy laws;ransomware attacks;it teams;regulated data;data exposure;retention policies;human error;sla policy;backed up;single signon;federal government;suspicious activity;all users;data organizations;authentication methods;virtual machine;types of data;rubrik zero trust;zero trust architecture;multifactor authentication mfa;sensitive data exposure;least privilege access;such as gdpr;single signon sso;strong authentication methods;automating the process;sec rule 17a4f;finra rule 4511c;continuous security monitoring;applicable privacy laws;riskbased access controls;heavily regulated industries;rubrik support team;traditional security models;essence of security;new security landscape;unmanaged objects report;rubrik compliance team;such as multifactor authentication;certain types of data;rubrik zero trust architecture
multi factor authentication,
sso,it is;data protection;access management;for example;active directory;rolebased access;user access;multifactor authentication;control plane;setting up;login credentials;service provider;example a;single signon;saas applications;identity provider;oracle database;authentication method;and databases;web applications;manual effort;authenticate users;logs in;additional information;enables users;manual work;user activities;provisioning process;windows server;multiple applications;in the cloud;multifactor authentication mfa;do not need;username and password;single signon sso;single control plane;windows server license;database configuration assistant;proxybased control plane;single signon provider;securely route traffic;book a flight;rental car deal;saml security assertion;rental agency website;identity and access management;mandatory totp multifactor authentication;active directory federation services;oracle net configuration assistant;separate set of credentials
regulatory compliance requirements,data protection;personal data;for example;respond to;protection regulation;regulatory requirements;compliance requirements;regulatory compliance;third parties;privacy shield;data organizations;data transfer;relevant data;ensuring compliance;dsar requests;additional information;demonstrate compliance;restricting access;dsar request;timely manner;authorized personnel;information organizations;contractual clauses;protection legislation;secure systems;different countries;regulatory investigation;data protection regulation;regulatory compliance requirements;standard contractual clauses;international data transfer;privacy shield framework;data protection legislation;verifying the identity;record of dsars;date of receipt;general data protection regulation;international data transfer laws;nature of the request;accurate and complete information;security of personal data;outcome of the request
attribute based access control,data security;access control;control access
sensitive data exposure,it is;data protection;data privacy;sensitive data;data security;personal data;personal information;and security;data breach;data breaches;data discovery;security posture;machine learning;sensitive information;and governance;incident response;data intelligence;unauthorized access;access controls;risk management;privacy regulations;security teams;data loss;attack surface;privacy act;content marketing;security measures;consumer privacy;cloud environments;risk assessment;content marketing manager;data security posture;data protection regulation;security posture management;university of denver;consumer privacy act;data intelligence platform;sensitive data discovery;reduce the risk;sensitive data exposure;data loss prevention;protect sensitive data;incident response plan;data privacy regulations;entire data landscape;machine learning algorithms;classify sensitive data;such as gdpr;identify sensitive data;protect sensitive information;prevent data breaches;hybrid cloud environments;free 11 demo;millions of dollars;such as access;compliance with regulations;pay a ransom;mapping data flows;personal identifiable information;federal trade commission;general data protection regulation;data security posture management;industry leading dspm provider;california consumer privacy act;importance of data security;and protect sensitive data;personal identifiable information pii;data loss prevention tools;sensitive data exposure incident
indicators of compromise,production systems;reactive monitoring;threat knowledge
